publishedAt,authorDisplayName,textDisplay,polarity_score,polarity
2023-09-27T11:39:04Z,@andriannovisusanto2210,kasian skrng saya melihat produk umkm seperti mati suri bahkan ngak laku sama sekali mereka ingin mengikuti trend tapi karena segi umur mereka hanya menerima bln sekali dapat penjulan pcs,5,positive
2023-09-27T11:33:04Z,@JujukKedang-ln6ni,pedagang lokal sepi di setiap pasar orang sekarang belanja online maknya pedanag di pasar menurun pendapatanya,-4,negative
2023-09-27T11:31:25Z,@jojorahaju342,harusnya yg diatur itu sistem import barangnya kalo menurut saya,-3,negative
2023-09-27T11:18:07Z,@fatmawatialwi9639,sy penjual ikan asin dipasar skr kita bersaing dengan nelayan yg jual langsung ikanx di medsos padahal kita ambil ma nelayan hargax sama dengan postingan nelayan kita bayar sewa byar retribusi apkah sy harus jadi nelayan supaya harga sama dilema kan,-1,negative
2023-09-27T11:00:42Z,@Ayahe-we8fv,jaman kemajuan kok dilarang pedagang offline aja grosir di toko online kalo semua dijadikan manual transaksi keuangan di hilangkan saja kembali kejaman dulu sekalian kirim surat lewat kantor pos,-2,negative
2023-09-27T10:28:46Z,@carimkarimun5474,beli oflen udh gk jaman,0,neutral
2023-09-27T10:28:09Z,@carimkarimun5474,enak blanja onlen gk ribet nunggu di rumah barang sampailah,5,positive
2023-09-27T10:25:43Z,@perinduumum7731,top lah,5,positive
2023-09-27T10:20:59Z,@gombalgambuludinstress,yg jd masalah platform ecomerce menyajikan paylater buat kita beli bayar nanti,-2,negative
2023-09-27T10:01:55Z,@DimaSTR,coba nanti lihat setelah dilarang pasar tanah abang bakal rame lagi gak br kalau tetap sepi berarti gak ngaruh apa apa,-7,negative
2023-09-27T09:56:55Z,@engingeng8120,pemerintah harus adil semua e commerce dilarang untuk melindungi pasar tradisional jgn jadi banci dalam mengeluarkan kebijakan,-10,negative
2023-09-27T09:47:41Z,@ryu5838,dilema bgt mau coment apa binggung kita mah cuma konsumen,-4,negative
2023-09-27T09:44:59Z,@rockylee4696,yah setelah promosi di tiktok commerce lalu click link menuju tiktok shop alias commerce sama saja bisa di diskon pemerintah aneh apa bedanya klik link untuk mendapat diskon langsung ke commerce tiktok shop lalu langsung diskon promo peraturan ngak ada guna,26,positive
2023-09-27T09:41:10Z,@NanifcdLinda,artis aja dagang br yakin gak nih peraturan ini,6,positive
2023-09-27T09:33:40Z,@user-oh1fs6jp3v,terimakasih pemerintah telah menyelamatkn kita sebagai pedagang,2,positive
2023-09-27T09:33:09Z,@saniaSamara-tm8rf,hancur an umkm di rezim ini udah gagal pemerintah dari segala bidang gara pembangunan selamat menikmati utuk generasi tahun dan buat generasi sekarang harus kuat mental kuat nahan lapar dan harus kuat berfikir,-26,negative
2023-09-27T09:21:30Z,@hendriyahya7995,salahin tuh artis yang jualan produk sembako harga jual gak masuk akal bikin rusuh pedagang offline dan online juga kena imbasnya semua,-3,negative
2023-09-27T09:04:44Z,@arfanlazuardi7080,artis aj jualan,3,positive
2023-09-27T08:55:43Z,@bagasnaxankem2721,masih ada tuh keranjangnya di tiktok,4,positive
2023-09-27T08:52:04Z,@doffyflaming6603,karena app luar jadi tidak sesuai di negara kita,-4,negative
2023-09-27T08:45:54Z,@kaysapropertydecor,setuju tutup aja tiktok shop yg penting shope lazada tokped fb jangan ya,7,positive
2023-09-27T08:41:41Z,@alexganesha187,rakyat tidk setuju,4,positive
2023-09-27T08:22:22Z,@myselflove4750,udah dilarang ya br tapi barusan gw masih belanja di tiktok,3,positive
2023-09-27T08:16:36Z,@Wildanmutiara,sangat setuju tiktok shop ditutup,7,positive
2023-09-27T08:08:32Z,@raharjomunas1822,kurang setorannya,-3,negative
2023-09-27T08:04:40Z,@user-dg7hr2rm5i,tp pemerintah kenapa gak berani menutup pinjol mlh makin lm makin banyak yg baru apa pajaknya besar atau gmn,5,positive
2023-09-27T08:03:27Z,@ayusrirahayu3247,yaa dari pada mati usaha lokal mending mati tik tok lok pengaruhnya semua pedagan umkm indonesia tik tok kalau mati pengaruhnya cuma tik tok aja jadi negarah kita aman masalah yg suda jualan di tik tok berusahala berjualan seperti rakyat kecil biar tahu caranya cari uangnya,-1,negative
2023-09-27T07:58:51Z,@ayusrirahayu3247,saya setuju kalau di larang,-3,negative
2023-09-27T07:56:00Z,@rafatharkoi249,sangat setuju tiktok shop ditutup,7,positive
2023-09-27T07:53:12Z,@yanuarrandy8546,aplikasi yang lain juga di blokir juga bukan tik tok doang,-18,negative
2023-09-27T07:52:19Z,@hono6490,alhamdulillah,5,positive
2023-09-27T07:49:23Z,@adigamingpemula1135,mkanya jgn bnyak gaya suka pamer,0,neutral
2023-09-27T07:30:50Z,@ikhsansunarhadi2967,hidup offline hidup umkm intinya di online harga amburadul persaingan gak fair,5,positive
2023-09-27T07:28:38Z,@AndyWilliams-kn7hq,nah itu baru pemerintah yang mantap br kebijakan yg berpihak kepada masyarakat indonesia br saya kasih pak jokowi dua jempol,5,positive
2023-09-27T07:25:16Z,@dahnialamsyah4731,masalah nya anda tidak bayar pajak,-12,negative
2023-09-27T07:11:18Z,@egyjhon8107,lah live shopee gimana tuh dia bukan sosial comers tapi ecomers tapi jualan harganya gak masuk akal itu gimana tuh regulasinya yg jelas lah terus facebook juga bukan ecomers tapi dia bisa juga jualan online live juga gimana tuh,-4,negative
2023-09-27T07:04:36Z,@adeypinotz4132,gimana cara mereka melarangnya ya,4,positive
2023-09-27T06:45:08Z,@adearpian3502,intinya penakut takut gak laku takut bangkrut takut gak makan pdh rezeki sdh ada yg atur gak akan tertukar,10,positive
2023-09-27T10:20:23Z,@PakGohan1560,ini baru komentar yg pas padahal rezeki kita itu udah di atur oleh sang pencipta sekuat apapun usaha kita dan sesantai apapun kita rezeki itu tetap sesuai takaran,11,positive
2023-09-27T06:41:47Z,@wargasipil6228,buat mbak mbak di video jgn bingung krna urusan perdagangan dr jaman belanda ga ada tik tok juga jalan itu tanpa platform online juga jalan dan esensinya bisnis ini yah kita bicara pasar sudah hal umum soal perpindahan uang dr tangan satu ke tangan lain dasarnya ketika satu org tambah kaya bisa jadi bbrp org menurun kekayaannya itu lah transaksi yg jadi problematika nih yah sudah ga ada pembatas antara distributor pabrik besar dengan end user mereka direct langsung ke bawah blum lagi yg direct itu ternyata dr negara tetangga bukan produk lokal jadi hancurlah pasar lokal kita yg kita mau itu menghidupkan kembali pasar lokal kita utk perbaikan ekonomi kita br br dr mbak mbak nya deh yg merasa di rugikan dgn penutupan tik tok coba di survey berapa yg tertolong brp yg menolak biar kelihatan jelas nih krna dl dagang di tanah abang itu bisa bal bal an sekarang ketengan aja susah kasihan,29,positive
2023-09-27T06:41:40Z,@ZMplay-,semangat guys dukung selalu artis lokal yang marukk,6,positive
2023-09-27T06:40:46Z,@MuhammadMadubronto,josss,0,neutral
2023-09-27T06:17:47Z,@bangfei6856,sy lbh setuju kl penjual online khusus pembelian grosir jd pembeli nya para pedagang offline konsumen eceran membeli di pedagang offline semua bisa lancar konsumen jg bisa tau harga belinya brp jual brp penjual online jg di untungkan krn pedagang offline yg beli secara partai jumlah yg bnyk penjual offline tdk tkt kehilangan pembeli perputaran uang akan normal,12,positive
2023-09-27T06:06:42Z,@yntktsw8758,alhamdulilah sy dukung pemerintah kasian pedagang kecil yang tidak mengerti caranya berjualan lewat online,-5,negative
2023-09-27T23:36:27Z,@anshorisfamily952,ya belajar dong biar pinter,13,positive
2023-09-29T17:48:00Z,@likefishing99,aduh bukan ituu cui anda tauu platform onlen tu byk bukan tiktok ajaa bambang lazada ada shopee ada buka lapak ada aduhh pemerintahh itu salah ambil langkah,-1,negative
2023-10-05T07:32:32Z,@barakusumo7456,awalnya semua orang juga ga bisa tapi karna keiinginan buat bisa akhirnya jd bisa intinya mau belajar jangan males,-1,negative
2023-10-06T03:01:45Z,@salamsadar5890,ohh iyaaa si paling pinterrrr kek cuma muncung kau aja ku tengo yg ngerti komputer di dunia ini bukan itu masalah nya jancok harga barang yg kau jual itu kek harga sayur sayuran kau buat ada yg masa baju kaos rupiah kimak kali kelen udah sama harga kaos sama harga sayur manis dan sayur kol kalian buat malah kadang lebih murah dari sayur kalian buat ngotak kau sikit kimakmu kecil kau di kasi susu besar kau nyusahin,9,positive
2023-10-06T11:54:53Z,@Anastasia-iz2bw,mangkanya belajarlah anaknya saja suruh sekolah masa orang tua jualan di hp saja males malesan payah br br sekarang jaman nuklir bukan jaman batu,-17,negative
2023-09-27T06:02:36Z,@kontolngacengan7927,quot manusia memperoleh apa yg mereka usahakan quot sprtiny kalimat sakti itu brlaku di konoha,-5,negative
2023-09-27T05:58:04Z,@selamatheriyono7874,like,0,neutral
2023-09-27T05:52:13Z,@NatalisEvander,pembeli tu suka beli barang yg berkualitas dan murah bukan beli barang mahal tapi ga berkualitas,18,positive
2023-09-27T05:44:32Z,@Hari-tv,dan banyak yg juga bahkan pendapatannya kurang dari mohon melihat dari dua sisi dan mencari solusi yg tidak menimbulkan kerugian kedua sisi,-10,negative
2023-09-27T05:31:37Z,@hakamil2691,bubarlan mentri perdagangan,0,neutral
2023-09-27T05:31:05Z,@yudhapapa2975,pasar abang sepi kok seluruh seller kena sanksi,-6,negative
2023-09-27T05:19:45Z,@tukangcuratcoret,entah corona itu asli atau bukan tapi di saat itu cina malah memanfaatkan situasi lockdown buat berdagang tiktok,-4,negative
2023-09-27T05:19:03Z,@EscortaBayu,tetep harus ada aturan ga bisa bebas liar yang kuat makin kuat yang lemah makin lemah dengan adanya aturan diharapkan yang kuat ga terlalu kuat yang lemah bisa dikuatkan menjaga keseimbangan,0,neutral
2023-09-27T05:18:26Z,@perbaikisaja3787,yang kaya makin kaya yang miskin makin terpuruk jadi paham yah kakak semua di toktok ini kepentingan masyarakat luas br so jadi saya setuju dengan kebijakan ini,0,neutral
2023-09-27T05:18:15Z,@Aisyaharip93,ga stuju juga kalau distop dunia online sypum belanja online tp offline juga tp minimal kasih peraturan supaya gak yang seperti org org bilang yang kaya makin kaya yg miskinmakin miskin,-12,negative
2023-09-27T05:09:17Z,@anomromdoni5002,alhamdulillah tik tok shopp dilarang jaya selalu pemerintah dan semoga rame pedagang pasar rame lgi,10,positive
2023-09-27T05:02:37Z,@erikistrada403,justru krna live orang bs tau real barang dr pd cek out lgsg suka banyak di tipu pemerintah nanggung riwehhh hp aja yg di hapuss sah digital digital,4,positive
2023-09-27T04:53:44Z,@dayatkusuma9588,yang rakus makin gila,0,neutral
2023-09-27T04:44:26Z,@irochaosendlesstower,untung mainya youtube,3,positive
2023-09-27T04:39:58Z,@TriSekar-dm2vx,kasian pasar tradisional kalau lewat online jualan,-6,negative
2023-09-27T04:32:15Z,@malik08819,bagus lah sama sama enak sama sama gk enak,24,positive
2023-09-27T04:29:59Z,@tomokoaerobic7570,jangan hanya tiktok saja market plist ada banyak aplikasi yg online harus di larang karena mereka buat keuntungan pribadi banyak usaha quot prodak di pasar dan mall banyak yg bangkrut padahal mereka membantu pemerintah pengadaan lapangan pekerjaaan kalau market paling brp orng karyawan,-1,negative
2023-09-27T04:28:03Z,@restioktayulia9803,bayar nya di wa ja sama ja bohong pak,-1,negative
2023-09-27T04:26:29Z,@jaktimjakarta8893,dilema pemerintah wkwkwk,0,neutral
2023-09-27T04:23:16Z,@wandisopian2762,cintailah produk lokal biasakan beli barang lokal beli produk lokal berarti cinta nkri,14,positive
2023-09-27T05:37:58Z,@ranggasyailendra6492,lah yg di tiktok juga ada umkm lokal,4,positive
2023-09-27T18:34:23Z,@nicholasarjuna5858,gmn sih di tiktokshop tuh banyak produk lokal seluruh indonesia lah ini sehat cuman pasar tanah abang harus menggulung umkm seluruh indonesia,1,positive
2023-09-28T03:00:34Z,@jayenmuhammad,soal elektronik khusus nya smartphone produk buatan lokal kualitas nya dibawah standard gimana mau cinta produk lokal,21,positive
2023-09-28T03:26:56Z,@nicholasarjuna5858,kalau elektronik gaes mungkin kalau clothing indonesia lebih bagus brand lokal contoh uniqlo erigo aerostreet maternal,0,neutral
2023-09-28T13:08:38Z,@mieramen7358,ini murni persaingan platform online shop umkm dan pasar konvensional pd tutup cm alesan bae,-2,negative
2023-09-27T04:17:27Z,@arigaul765,ini gegara artis ikut ikutan jualan padahal mereka udah pada kaya kok masih jualan,1,positive
2023-09-27T04:16:10Z,@susantiayong3056,kapan mulai diberlakukan sampai kmren masih pada jualan tuh,1,positive
2023-09-27T04:13:12Z,@IlangPraja-jv1qp,seharusnya yang jadi permasalahan itu produk import dengan merusak harga pasar bukan platform nya hahahahhahhahah,-1,negative
2023-09-27T04:01:16Z,@lampucoklat,jalur distribusi pasar tradisional itu panjang makanya harga jual mahal belum lagi ditambah cost sewa lapak listrik dll kalo barang di tanah abang juga sama sama banyak import nya sebenarnya bukan masalah barang nya tapi masalah jalur distribusi yg bikin harga di tanah abang mahal karena kalo pingin murah beli di tanah abang harus beli banyak atau model grosir nah apakah masyarakat harus beli banyak kalo pingin murah padahal barang yg dibutuhkan cuma untuk satu jenis barang ya karena dari itu masyarakat cenderung beli di tiktok dan medsos atau platform e commerce lainnya,11,positive
2023-09-27T10:32:38Z,@rati2451,iya betul sekali apa yg anda sampaikan kita pembeli sudah pst nyari yg praktis tnp bercape dn kluar ongkos besar trus kita kdg butuh dg ap yg mau kita beli hnya satu sesuai kebutuhan dn cocok dg ap yg kita inginkan tp syg td bisa hrs minimal potong pembeli semua untuk di jual kmbali tp untuk kperluan pribadi disinipun kita sudah kecewa nah klo di online kita bisa di layani sesuai dg yg kita pesan dan butuhkan td dg persyaratan minimal pembelian soal kwalitas sudah pst di sesuaikan dg barang itu sendiri ad rupa ad harga istilahnya disini sy mengharapkan pasar oflane ad gebrakan baru dg pelayanan juga klo bisa buka online juga sehingga pelanggan yg terbiasa beli di toko juga tau klo toko melayani online untuk pelanggannya,44,positive
2023-09-27T03:58:59Z,@pengkhianat24,go food gimana,0,neutral
2023-09-27T03:58:29Z,@cuan.ex-item,pengalihan isu rempang,-1,negative
2023-09-27T03:58:08Z,@user-xc5ey1td4f,pindah live di shopee kan bisa tik tok hanya buat jual paha sama dada aja dah,4,positive
2023-09-27T03:53:33Z,@naomieleonora,orang hanya memanfaatkan era digital pemerintah tdk akan mampu bertahan lama dengan kebijakan ini krn eranya memang berubah yg perlu dilakukan adalah meregulasi e commerce itu sendiri bukan melarang orang yg berkecimpung dlm perdagangan e commerce tp mendorong pedagang conventional mengupate bisnisnya menjadi e commerce,-7,negative
2023-09-27T05:54:44Z,@ahmadfathulmubarok1521,iya gw setuju sih kalo org itu biar gk ketinggalan zaman bgt era semakin canggih masa masih berfikir sok idealis mulu harus realistis mengikuti zaman tapi jangan melenceng dari nilai moral dan akhlak,10,positive
2023-09-27T06:01:54Z,@naomieleonora,tanah abang yg kosong itu jadikan food court guarantee auto rame orang jakarta gila kuliner plus bersosialisasi cocok buat tempat kumpul ngebahas e commerce klu komoditasnya kuliner kurang bisa di e commerce kan krn lidah indo doyan yg langsung dr kompor engga doyan makanan frozen,-1,negative
2023-09-29T02:13:25Z,@yuliatin5710,dan tiktok adalah media sosial bkn commerce anda msh bisa jualan online commerce resmi,6,positive
2023-09-30T15:18:37Z,@naomieleonora,ecommerce quot or quot electronic commerce quot isthe trading of goods and services on the internet mau aplikasi di sosmed atau melalui websites selama dagang di internet semua e commerce,1,positive
2023-09-27T03:52:18Z,@GassingGassinggassing,jika berdagang apalagi online tdk ada yg mengatur dan hal yg bisa merugikan dan di era sekarang sistem outsourcing sangat merugikan karyawan swasta,9,positive
2023-09-27T03:51:37Z,@boysansama5855,konyoool seng gwe aturan podo ae mateni ekonomi hrs hrga di trun kn ben ekonomi stabil,3,positive
2023-09-27T03:49:52Z,@GassingGassinggassing,sekarang masyarakat indonesia lebih banyak beralih ke profesi berdagang karena salah satunya bekerja di perusahaan swasta terlalu banyak aturan yg selalu merugikan karyawan,3,positive
2023-09-27T06:24:16Z,@naomieleonora,karyawan itu budak dikasih air conditioner inget itu sekarang era quot be your own boss quot dagang kecil an hasilnya melebihi manager kantoran tp kerjanya,1,positive
2023-09-27T03:48:19Z,@sigitfidaus9330,rumit belanja offline sepi peminat hapus belanja online banyak kurir yg kehilangan kerjaan,-6,negative
2023-09-27T03:48:19Z,@ikramhidayat3310,nampak lah muka buluk penghancur pasar dagang,0,neutral
2023-09-27T03:47:49Z,@antondanovanmc1734,nah lo nah lo dlu aja pertama tiktok muncul gw mainan tiktok dibilang alay skrg apa pada lari ke tiktok wkwk br br instagram gmn kan ada jual beli online juga cm aplikasi tiktok aja ditutup msh bny aplikasi yg lain sosmed online,-14,negative
2023-09-27T03:44:40Z,@PantiusSinurat-sp5fo,toko online di batasi hari nya agar pasar tradisional msh bisa memutar uang,-8,negative
2023-09-27T03:43:39Z,@user-ed3rw6lf2p,atur regulasi hulu ke hilir jangan hulu langsung turun yg ada mati kutu yg di bawah agen kecil oe main online daj offline aja ga mampu berdiri semenjak ada online dan distributor besar turun langsung dan kasih harga besar an,31,positive
2023-09-27T03:21:02Z,@risckafujiastuti9092,poin revisinya apa saja y,-4,negative
2023-09-27T03:17:37Z,@virlita894,intinya tuh byk artis influencer yg ikut jualan secara mrka byk uang followers jdi pedagang kecil terimbas sepi,-6,negative
2023-09-27T03:16:45Z,@user-eo1et2oj9o,hahaha hahaha,0,neutral
2023-09-27T02:53:15Z,@ari1babe251,stop import itu intinya barang receh yg jumlahnya jutaan datang dari china seperti panci karpet blender sepatu dan lain stop datang dari china kita harus mampu ciptakan barang itu ditanah air,-20,negative
2023-09-27T02:49:23Z,@leniday7190,saya belanja online cuma beri ke jasa antarnya saja biar ada masukan mereka disamping harga yg pasti,10,positive
2023-09-27T02:49:01Z,@mamisuhartini6973,sdh ditutup saja biar kmbali ke semula datang ke toko utk beli barang,-4,negative
2023-09-27T02:48:09Z,@lusisugiharto6223,titok usaha yang hidup yang mati br ini fakta br lihat pusat pusat perdagangan sepi dan lesu br sementara pajak dan iuran pemerintah jln terus,-11,negative
2023-09-27T12:25:41Z,@Brntnm-qu3bp,bakal ngaruh ke pendapatan negara yg berkurang karena produk lokal gk laku malah ilegal dari china laku yg gk masuk pajak yg ada negara naikin lg hrga bbm ato sembako biar pendapatan nya stabil,0,neutral
2023-09-27T02:42:22Z,@user-rz6jr9be8y,ya mana tahan jualan offline berapa biaya sewa tempatnya itu kalau jualan offline makanya mahal harganya kalau ngak mana ketututp kontrakan ruko kios yang jadi masalah bukan noffline atau online tapi perbedaan harga yang jadi kunci permasalahannya,-7,negative
2023-09-27T02:39:11Z,@dodi5646,artis artis maruk salah satu penyebab semua mata tertuju ke tiktok shop setiap live pamerin omset puluhan miliyar sekali live jadi prasangka pemerintah dan masyarakat umum ygn jualan ditiktok itu rame semua padahal seller kecil juga pada sepi penonton juga sepi tiktokshop ditutup mereka artis masih banyak tabungan kalau kita seller kecil mau usaha apa lagi,-13,negative
2023-09-27T02:35:22Z,@minangbana9488,keluhan mereka kesusahan bayar kariawan br tapi keluhan pedagang pasar br kesusahan buat makan,-13,negative
2023-09-27T02:33:40Z,@kotabojonegoro,saya juga seller di tiktok tp saya lbh suka kebijakan ini sebab algoritma tiktok hanya membela yg bayar saja jutaan seller disana tp yg sukses prosentasenya kecil bgt itupun krn mrk bayar gede,1,positive
2023-09-29T02:06:15Z,@yuliatin5710,betul sekali tiktok hanya menaikkan barang yg laris manis dan yg menguntungkan sdgkan yg peminatnya kecil tdk di lirik apalagi di naikan jd keputusan bgs pemerintah ngambil langkah ini,12,positive
2023-09-27T02:31:39Z,@zonkman1137,pikirin rakyat kecil donk jangan pikirin artis yg gayanya gede tapi otaknya serakah,-4,negative
2023-09-27T02:28:41Z,@romyromyy3867,saya dukung pemerintah,1,positive
2023-09-27T02:23:32Z,@aylatifany1998,seharusnya semua comerce pecundang selamanya pecundang,-3,negative
2023-09-27T02:23:15Z,@dapurarpa5078,jokowi si raja ngibul rakyat rempang udh berjuang hbis an raja ngibul malah cengar cengir dan joget ikn br tpi ini mslah yg biasa aja dia lgsg tancap gas,-4,negative
2023-09-27T02:18:29Z,@annethakamase4573,tiktok tutup masi ada lazada dan shope kita liat aja setelah tiktok tutup apa penjualan ofline akan berkibar,0,neutral
2023-09-27T02:11:10Z,@MARVINGAYE662,saya setuju tiktok shop dilarang subsidi di tiktok shop oleh tiktok adalah proyek predatory pricing pembunuh umkm setelah umkm mati semua kalau nanti harga dinaikkan kita sebagai negara tanpa produsen amp hanya konsumen bisa apa sangat berbahaya tiktok shop manis di depan tapi akhirnya menghancurkan di belakang,-10,negative
2023-09-27T09:57:35Z,@albertneindra9078,betul sekali setuju,5,positive
2023-09-27T13:36:33Z,@wahyukun9291,nah ini sama dengan yang otak gue pikirin,1,positive
2023-09-27T23:19:13Z,@user-qk8ht3xe6j,betuuul analisa yg real ayoo bangkitkan kembali pasar tradisional belanja produk lokal termasuj jajanan asli indonesia,4,positive
2023-09-29T05:45:56Z,@Dicolok.kempot_dicabut.Monyong,menyumbangkan devisa tepatnya bang masyarakat kita memang mikirnya murah tp perlahan membunuh rupiah dan untuk jangka panjang ini tidak baik,10,positive
2023-09-27T02:08:05Z,@AmeliaSintiya12-dz9gs,artis yang tamak emang gitu sifat asli manusia itu kebanyakan bisa dilihat dari uang,-1,negative
2023-09-27T02:07:46Z,@tamiyamiya9344,mulai kapan sampai hari ini masih bisa jualan ditiktok tuh,4,positive
2023-09-27T02:03:25Z,@destiaprianti5559,yang mau jualan tik tok lu jualan aja sana d cina,3,positive
2023-09-27T02:02:20Z,@destiaprianti5559,nambah gimana ynf lo jual barang impor koplok lo jualan aja sana cina,3,positive
2023-09-27T01:58:26Z,@IisSah-ox9tr,untuk kaum muda dan yg tua di pilpres harus bisa mengarahkan suaranya ke capres dan partai yg pemikirannya luas merakyat yg mendahulukan tabayyun like yg setuju,-1,negative
2023-09-27T01:56:21Z,@IisSah-ox9tr,di fikir yg mencari mata pencaharian di tiktok sedikit,-9,negative
2023-09-27T01:09:39Z,@doatunis5931,gua setuju tutup aja,0,neutral
2023-09-27T00:51:09Z,@yukodya,saya pengguna commerce lebih sering beli produk lokal praktis harga lebih murah barang cek lewat live atau chat br br produsen kalo jualan mesti ambil langkah baru sih ke dunia digital bukan sosial media shop,21,positive
2023-09-27T00:51:03Z,@jugihandoko,kalau toko tanah abang tutup memang sejak pandemi,-4,negative
2023-09-27T00:49:34Z,@jugihandoko,semakin yakin pilin amin anies basweddan cak imin,8,positive
2023-09-27T00:39:33Z,@Vallery_Kamovka,prediksi bossman mardigu wowiek ternyata terbukti hari ini produk luar yg mayoritas dari china dg strategi banting harga cara marketing penjualanya yg ngikutin trend skrg pelan pelan mematikan umkm,8,positive
2023-09-27T00:39:26Z,@acdaikinchiller1569,lebih dukung onlen kernamurahh,5,positive
2023-09-27T00:37:22Z,@dinssae363,hore hore,0,neutral
2023-09-27T00:32:02Z,@cellglassr1484,pembeli online lari keshopee tokopedia lazada,0,neutral
2023-09-27T00:12:25Z,@kobokanaeru4569,inti masalahnya sebenernya bukan di quot digitalisasi quot nya br tapi lebih ke harga di online yg lebih murah br karena mereka ga perlu sewa tempat bayar listrik air dsb br jadi mungkin bisa untuk pajak di aplikasi tsb di naik kan sehingga harga nya bakal bersaing ama harga penjual offline,2,positive
2023-09-29T02:26:11Z,@yuliatin5710,nah ini baru bener jadi tdk akan ada perang harga cuma produk yg benar di butuhkan dan di minati yg akan di beli masyarakat bkn krn cm iming murahnya tp membunuh yg lain,8,positive
2023-09-27T00:06:32Z,@TriIswahyudi-hc8zn,orang artis aja masih serakah aja makanya duit mutarnya ke orang kaya aja orang lapangan makanya skg sepi,7,positive
2023-09-26T23:59:26Z,@Ikbalrizkya,saya setuju sih jualan di tiktok dilarang,-1,negative
2023-09-26T23:57:11Z,@Nurhasanah-yb3de,indonesia indonesia,0,neutral
2023-09-26T23:55:58Z,@user-hb6py4bw1x,jadi fungsi pemerintah itu apa,-4,negative
2023-09-26T23:47:02Z,@Arnasyam-ig7zk,semua dihapus online shop,-3,negative
2023-09-26T23:43:23Z,@Arnasyam-ig7zk,ini hanya tiktok apa semua yg online shop semoga mall pasar kembali rame,-7,negative
2023-09-26T23:36:22Z,@Musliman123,demo aja pra tik tokerr,-2,negative
2023-09-26T23:35:15Z,@Musliman123,udah maju mundur lgi kucluk kuclukk,0,neutral
2023-09-26T23:30:17Z,@hendarsyahsuhendar1067,msh ada shopee tu tanah abang jadiin rpth,4,positive
2023-09-26T23:29:24Z,@bangudin3309,s nih pemerintah,0,neutral
2023-09-26T22:54:05Z,@Bingchilling606,apus juga tokopedia shopi dll merugikan pedagang,0,neutral
2023-09-26T22:46:30Z,@capt.quantum,kalo bandel diatur tutup saja aplikasinya coba lihat udah banyak negara lain yg nutup aplikasi itu,-12,negative
2023-09-26T22:27:39Z,@sastrowitra60,apa boleh br apa di usir paksa br perut kita lapar apa kalian itu ngasih makan kemakmuran kita kan enggakkk,-18,negative
2023-09-26T22:26:12Z,@cepisas,balikin jaringan internet ke g ajh pasti aman,6,positive
2023-09-26T22:19:58Z,@fatimabubi5703,ribu juta perhari besar itu coba tunjukin bayar pajak gak ke negara,4,positive
2023-09-26T22:13:29Z,@iqbalbachtiar9504,lebih ke adab sih kesadaran dari artis dan influencer untuk tidak memasarkan produk dari luar yang secara nyata menumbangkan produk lokal,0,neutral
2023-09-27T03:42:54Z,@mustaminsabe3285,soalnya produk dlm ada yg tdk bekualitas di pake satu kali sdh rusak,12,positive
2023-09-27T05:20:19Z,@perbaikisaja3787,produk luar gak ada cacat produksi apa cacat produksi ada dimana klo menurut saya,-1,negative
2023-09-27T22:46:13Z,@quickcinema8031,artis mana punya adab mereka masa bodoh yang penting cuann,6,positive
