publishedAt,authorDisplayName,textDisplay,polarity_score,polarity
2023-10-04T01:24:07Z,@akungratis2438,a href bersurat ke saya sok kuasa lu jadi kementrian itu punya elu sendiri orang begini kok jadi mantri,2,positive
2023-10-04T01:28:30Z,@kriST0_5tar1nd0,a href about invalid href about invalid,-10,negative
2023-10-04T01:40:43Z,@ambarlm5489,ya mungkin isi suratnya br yth br menteri perdagangan zuklifi hasan br br sensian amat bang emang ente liat isi suratnya,16,positive
2023-10-04T01:19:12Z,@buffalowofficial9181,orang mw berusaha sendiri malah di larang kocak emg pemerintah,-6,negative
2023-10-04T02:39:47Z,@caem22,yg lucu situ simak lgi biar pinter,12,positive
2023-10-04T01:18:17Z,@rockhim2616,info loker banh,-3,negative
2023-10-04T01:18:15Z,@omjo7715,jaman semakin modern tapi pemerintah justru memaksa warganya untuk tetap primitif,9,positive
2023-10-04T01:23:36Z,@NEONGAMING1995,lu kira di indo doang yang melarang tiktok shop di negara maju aja melarang tiktok shop,-10,negative
2023-10-04T01:25:20Z,@ambarlm5489,ya namanya bernegara harus ada peraturan dan regulasi bang br kalo semua inovasi boleh bebas dunia ancur br sampe ada regulasi yang jelas untuk social commerce ya ikutin dulu peraturan e commerce yang ada,6,positive
2023-10-04T01:26:11Z,@user-wb3sm3bm4m,justrus otakmu itu yg gk maju quot,-2,negative
2023-10-04T04:22:11Z,@cintasetyareni7163,dilarang tp ada persiapan cabang misal menbuat apk baru bkn langsung di block,2,positive
2023-10-06T07:13:21Z,@pinguinmezir5943,cemas kali kau rupanya cuman tiktok shop yg tutup kau pun cemas masih ada tokopedia shopee dll,-7,negative
2023-10-04T01:17:17Z,@user-ze4cb9ho9o,alhamdulilah moga dagang di onlen di hapus karena kita pedagang sangat di rugikan,1,positive
2023-10-04T01:39:25Z,@crcr662,yg lebih rugi skrg pemilik ruko kios dan lapak lainya gak ada penyewa,3,positive
2023-10-04T03:28:08Z,@user-gi8ue9fr3w,usah panas setiap kebijakan gak bakal pernah sampai menguntungkan kedua duanya pasti akan ada salah satu yg di korbankan di dunia ini gak ada yg namanya keadilan,19,positive
2023-10-04T01:14:42Z,@cahayahati5237,blm pernah blnja di tiktokshop,0,neutral
2023-10-04T01:14:41Z,@syifaelfath6608,aku yang ga pernah beli di tiktok br seringnya di shopee,-1,negative
2023-10-04T02:06:21Z,@muamarrizal2698,mantap lazada atau shopee,5,positive
2023-10-04T01:09:26Z,@yuliahartita876,ada sebagian yang diuntungkan ada sebagian yang dirugikan selaku orang kecil saya merasa ngenes sekali karna kehilangan sumber pendapatan sehari,-17,negative
2023-10-04T01:08:24Z,@Agussunaryo,alhamdulillah,5,positive
2023-10-04T01:02:45Z,@YuiKosaka-gk7hg,saya sebagai pedagang tradisional sangat berterimakasih atas keputusan ini,-8,negative
2023-10-04T01:35:43Z,@crcr662,sama ajah ada lazada yg harganya juga murah parah mirip tik tok,6,positive
2023-10-04T02:02:27Z,@hendyadheeva666,lazada bukan medsos,-3,negative
2023-10-04T02:06:58Z,@fidicraft,ngerepotin aja,1,positive
2023-10-04T02:22:17Z,@xexoxee3,enak gapanas an dan ga desek an,5,positive
2023-10-04T02:37:17Z,@caem22,kalo lazada gk keterlaluan,-5,negative
2023-10-04T01:00:15Z,@annisalingga8150,,0,neutral
2023-10-04T01:00:53Z,@kriST0_5tar1nd0,a href about invalid,-5,negative
2023-10-04T00:59:06Z,@kriST0_5tar1nd0,b situasi mall sepi krn biaya parkir mahal bin mehong b,-1,negative
2023-10-04T00:56:54Z,@GabriellaSabatini1512,yang begini di urus sama pemerintah,-3,negative
2023-10-04T00:54:31Z,@user-xy3nl5tp4h,tik tok hancur influencer semua semua,-6,negative
2023-10-04T00:54:11Z,@saepuloh475,tik tok easy we have lot of money indonesiaa,-5,negative
2023-10-04T00:52:49Z,@kokisengsih5972,masih bisa tuh,0,neutral
2023-10-04T02:50:35Z,@caem22,sampe jm sore aja ko kwkwkkwkwkk,1,positive
2023-10-04T00:50:02Z,@herususanto6657,alkhamdulilah mantap buat pemerintah,6,positive
2023-10-04T00:49:06Z,@delansupriatna,menurut saya kenapa gak boleh jual di media sosial karena pemerintah nya tak mampu menaggani pemerintahan nya,7,positive
2023-10-04T08:14:10Z,@bambangpurnama2655,alhamdulillah bubar,5,positive
2023-10-04T00:44:29Z,@handrihsd6201,pdahl tingl yang punya toko bikin tik tok shop apa susahnya,-8,negative
2023-10-04T02:48:57Z,@caem22,masalahnya tiktok shopnya ilegal,0,neutral
2023-10-04T04:24:45Z,@cintasetyareni7163,yg di hapus itu toko yg ilegal bkn di block semua otomatis kena imbas yg legal sdh resmi malah ke ikut brokir,-17,negative
2023-10-04T00:32:42Z,@anasarrow3708,biarlah kementrian yg lain di pemerintahan bejad ini pd ancur asal jangan kementrian perdagangan ini tetap jaya dan mendag nya sehat sehat selalu kinerja nya bagus dn baik mengambil langkah keberpihakan kpd perekonomian rakyat sbgai ujung tombak system ekonomi karena rakyat lebih membutuhkan perekonomian yg sejahtera di banding kementrian yg lain yg busuk dan bejad,6,positive
2023-10-04T00:32:35Z,@chunji7981,gpp tiktok tutup asal lazada dan teman jangan wkwk,-5,negative
2023-10-04T00:32:32Z,@Dr._Atom,kita lihat sampai kapan aturan ini berlaku he he,5,positive
2023-10-04T01:52:18Z,@ajianoronaldo6324,tar juga berubah aturan kalo udah di kepret duit,0,neutral
2023-10-04T00:27:41Z,@zonaiwak2617,,0,neutral
2023-10-04T00:25:30Z,@galerivario2289,shopee lazada hapus co,-3,negative
2023-10-04T01:45:45Z,@notme4354,kgk lah itu kan emang udh dari awalnya commerce beda sama tiktok yg awalnya apk media sosial,-3,negative
2023-10-04T00:12:37Z,@adikrahwana7121,dibentak china ngeper ga tuh larangannya,0,neutral
2023-10-04T00:09:34Z,@lizaindo2000,nggak jelas memangnya apa kerugiannya kalau media sosial bergabung dengan media yg commerce tolong jelaskan ke masyarakat sebelum keluarkan aturannya dodol,-4,negative
2023-10-04T00:55:17Z,@kriST0_5tar1nd0,mau dong dodol nya,5,positive
2023-10-04T01:22:21Z,@ambarlm5489,karena belum ada peraturannya br br peraturan yang ada itu hanya untuk e commerce br bukan social commerce br sementara tiktok ngelas ngeles gak mau ikutin peraturan e commerce karena br mereka itu social media br nah biar tegas dilarang begitu loh br br atau bikin terpisah ikutin peraturan yang berlaku sekarang br sampai mungkin pemerintah menerbitkan peraturan baru untuk social commerce,-26,negative
2023-10-04T02:51:46Z,@caem22,yg jelas tiktok shop ada pajaknya,5,positive
2023-10-04T03:36:49Z,@lizaindo2000,trims,4,positive
2023-10-04T00:08:46Z,@alvero979,pembaca berita rambutnya kok begini hhhhhhhhh,-5,negative
2023-10-04T00:07:53Z,@stjotw8698,ayo para programmer indonesia buat platform yang sejenis totok shop tok tok shop tuk tuk shop tik tik shop dll buktikan bahwa menggelinding nya arah peradaban tidak bisa dibendung oleh mereka yang nyaman dengan status quo,-3,negative
2023-10-04T00:02:21Z,@riznarizna2783,aku pernah x di kirimi barang tanpa aku pesan ternyata ada orang yg pakai akun ku,10,positive
2023-10-04T02:15:49Z,@irt9791,kan tinggal usah bayar gitu aja relot,-2,negative
2023-10-04T02:46:48Z,@riznarizna2783,lha masalahnya aku pas keluar yg di rmah cma ada ortu lhaa sma ortu di terima lah orang aku jga gak tau kalw mo ada paket dtang,14,positive
2023-10-04T00:02:09Z,@gumilanglassukaseni,akhirnya semua harus melek kemajuan digital perubahan jaman segitu cepat sementara indonesia di sibukan dengan hoax di mana ekonomi di abaikan,-15,negative
2023-10-03T23:55:49Z,@masterkombak7834,harusnya dikasih regulasi,2,positive
2023-10-04T00:12:32Z,@arham8872,regulasi apa yg mau di kasih bg,4,positive
2023-10-04T09:22:45Z,@fmnt3260,sudah,3,positive
2023-10-18T15:03:11Z,@masterkombak7834,banyak contoh barang dari tiktok shop harus produk dalam negri harus mempekerjakan orang dalam negri mengurangi pengangguran dan bisa memutar ekonomi dalam negri,-2,negative
2023-10-03T23:55:02Z,@kenzolaarbianta8902,baguuuuss smuanya hrs di ttup yg menyesat kn rkyt kcl dl gda online tiktok mlh nyaman quot aj cr mkn gampang,8,positive
2023-10-03T23:53:44Z,@ronnyyulianto12,giliran barang bagus terjangkau yg peraturan lah ini it lah ya begini lah klau hidup negara konoha,10,positive
2023-10-04T00:26:30Z,@arham8872,pindah ke jepang bro yg negara industri klw di indo masyarakat nya rata bekarja di pasar mall swalayan ruko pedagang oflen,-1,negative
2023-10-04T01:37:57Z,@ambarlm5489,mending pindah ke negeri yang produksinya barangnya aja langsung bang br ngapain anda di konoha,1,positive
2023-10-04T09:24:02Z,@fmnt3260,lahh br gak pindah aja loe bang,2,positive
2023-10-03T23:52:49Z,@lensasenibudayaaceh,jika tidak sanggup menciptakan lapangan kerja seharusnya pemerintah tidak menutup tiktok shop tapi mengawasi inport ilegal br br hanya pak anies dan muhaimin yang peduli akan rakyat yang peduli akan pedagang online br br anies,-13,negative
2023-10-04T00:21:20Z,@arham8872,pemikran anda lucu pengaangguran banyak disebab oleh olshop terutama tiktok pasar mall swalayan kios pinggir jln banyak yg tutup jt org bisa membuat jt org jdi pengangguran br indonesia bukan negara industri seperti japang tpi negara yg masyarakat nya banyak usaha lewat toko kecil ukm dan umkm,2,positive
2023-10-04T01:19:40Z,@rockhim2616,yang bekerja di online shop itu juga banyak yang bagian packing admin gk cuma yang punya akun doanh,-18,negative
2023-10-04T01:47:16Z,@ambarlm5489,pengen jelasin tapi takut kepanjangan br intinya barang yang dijual di tiktokshop itu gak kena pajak pemasukan br br karena jualannya eceran bang br harga barang dibawah usd itu bebas pajak br br sementara pelaku usaha import yang lain itu masukin barang dalam jumlah banyak dipungut pajak dsb br baru dia jadi barang legal makanya harganya gak semurah yang di tiktokshop br br intinya pemerintah udah ngeluarin peraturan baru untuk barang social commerce bukannya dibiarin br kalo ikutin berita jangan setengah br br baru br pasal ayat menegaskan ppmse dengan model bisnis social commerce dilarang memfasilitasi transaksi pembayaran pada sistem elektroniknya,-53,negative
2023-10-03T23:46:00Z,@latifrunadyaugusteangsar8674,mestinya pemerintah sadar sepinya mall bukan karena tik tok shop melainkan rakyat indonesia ngak punya duit untuk beli ini itu jadi yg utama sekarang buat makan,2,positive
2023-10-03T23:54:47Z,@lensasenibudayaaceh,kebijakan yg tidak berpihak ke rakyat br hanya anies yg membela rakyat yang melakukan dagangan online,-10,negative
2023-10-04T00:10:46Z,@arham8872,ekonomi negara masih baik saja bg cuma duit udah di monopoli oleh onlen shop duit ngk berputar lagi di kalangan bawah sekarang duit langsung ke org kaya br bukti nya liat omset pedagang onlen sehari bisa dpt ratusan jt hingga milyar lebih,2,positive
2023-10-04T00:52:33Z,@kamilbintangutara,sumpah dmna umkm ngeluh lebih dari corona padahal tanggal muda tpi parah omset drastis turun dari sesudah lebaran haji tak kunjung membaik heran ku,-8,negative
2023-10-04T01:00:38Z,@user-cs9xq4qw7g,maaf anda warassss,1,positive
2023-10-03T23:43:46Z,@kartiyahs29,aku lebih suka belanja di tokonya langsung pilih bebas bisa langsung pegang barangnya bagus apa tidak soal harga lihat barang kalo bagus yg mahal kalo jelek murah,6,positive
2023-10-04T00:33:38Z,@tariofficial9902,sama mb aku orangnya simpell suka belanja di pasarr dri pd onlinee pernah online baju yang datang kayak saringan tahu,4,positive
2023-10-04T01:04:04Z,@drflasher7645,sama saya pernah belanja online x barang tidak sesuai foto nya bagus luar biasa tapi kenyataannya sudah kapok kalo beli make up dan baju dll saya seneng beli offline pegang barang langsung sekalian jalan,14,positive
2023-10-04T01:25:02Z,@supraptiprapti6528,sy jg pernah beli baju sepatu online tdk sesuai dgn fotonya amat sangat kecewa terakhir beli kursi ukir jepara jg mengecewakan sekarang kalau beli lebih baik langsung ke tokonya saja bisa milih langsung tahu barangnya,21,positive
2023-10-04T01:34:14Z,@rizalprasetyorizal519,jd bgmn dgn kami yg jauh dari kota,-8,negative
2023-10-04T01:35:03Z,@drflasher7645,betul mbak kalo sudah kadung beli terus jelek gitu kita mau komplain kemana tidak ada hukum yg jelas kita yg jelas dirugikan,11,positive
2023-10-03T23:42:44Z,@jamalnasir2794,kasihan dong pedagang kecil,1,positive
2023-10-04T00:16:31Z,@arham8872,pedagang kecil ngk ada yg bisa berkembang tiktok klw efiliet nya emang banyak penyambung tangan pemilik barang br pemilik barang rata org kya seprti pemilik kompeksi,15,positive
2023-10-04T03:14:58Z,@jamalnasir2794,bnr bg emang setiap pedagang pny smart phone mikir,2,positive
2023-10-03T23:40:39Z,@simawar4602,lah pampers ane gimana dung,0,neutral
2023-10-04T00:30:33Z,@arham8872,pake sendiri bg,-3,negative
2023-10-04T01:25:36Z,@simawar4602,bayi ane yg butuh bambang,-8,negative
2023-10-04T01:38:38Z,@ambarlm5489,jualin di t kped susah amat,1,positive
2023-10-03T23:40:06Z,@rizalkariyanto7006,pasti tik tok punya solusinya apapun semakin besar pasti ada saja batu sandungannya,21,positive
2023-10-04T01:28:04Z,@ashchanel1139,tiktok itu punya orng asing,1,positive
2023-10-04T05:35:09Z,@rudiharahap3497,lain juga punya org asing,-1,negative
2023-10-03T23:39:52Z,@bejolesperinggo,jangan tebang pilih itu gimana shopee lazada dan lainnya,-7,negative
2023-10-03T23:53:17Z,@finsaraditya6454,mereka sdh pny izinnya bang tiktok aja yg blm,1,positive
2023-10-03T23:57:07Z,@bejolesperinggo,bikin undang undangnya untuk melarangnya soalnya efeknya sama mematikan umkm offline juga malah mereka lebih duluan sedangkan tiktokshop kemudian,7,positive
2023-10-03T23:59:04Z,@hatori7720,yg lain sudah punya wadah berjualan sendiri boss tiktok masih campur,4,positive
2023-10-04T00:00:53Z,@bejolesperinggo,maksud saya efek ke umkm offline nya sama aja bosss,7,positive
2023-10-04T00:30:07Z,@arham8872,shope lazada aplk nya berat hp kentang ngelag,0,neutral
2023-10-03T23:39:34Z,@windasari563,tiktok ga jls dpt hadiah katanya juta masuk rek sukses pas di cek zonk klo cuma mau ngerjain org jangan lah berlebihan dasar php lah,-3,negative
2023-10-03T23:38:30Z,@redylombok6062,tutup tiktoknya baru bagus jangan menyalahkan orng bro,-3,negative
2023-10-04T00:35:29Z,@fauzanozon6186,pahami informasinya mas,2,positive
2023-10-03T23:38:05Z,@AishaPashaPatria,kenapa ya,4,positive
2023-10-03T23:41:35Z,@azfara6921,penjual oflen pada bangkrut,-8,negative
2023-10-03T23:48:10Z,@muchammadiqbal4989,usaha online bangkrut dan usaha offline bangkit kembali,-1,negative
2023-10-03T23:37:17Z,@fakta-baru,kalo saya tetap mendukung keadaan yang sekarang di mana jual beli online lebih laku dari pada offline soalnya yg offline terlalu banyak mengambil ke untungan mereka para pengusaha jual offline pingin cepet kaya meski mencekik saudara sendiri br jika jual beli online mau di tutup maka akan ada berapa juta pengangguran yang bisa terjadi pada kurir br sudah lah pak kita harus realistis lebih menguntungkan mana terhadap rakyat kecil antara jual beli online dan offline justru keadaan ini lebih memihak pada rakyat tidak mampu karena harganya lebih terjangkau br biarkan saja pak para pengusaha jual offline itu jangan terlalu di urus kita lihat aja ke bawah mereka yg tergolong rakyat tidak mampu yg awalnya tidak bisa beli sekarang karena ada jual beli online harganya murah dan terjangkau mereka bisa beli dan ada senyum bahagia di wajahnya,-1,negative
2023-10-03T23:42:32Z,@simawar4602,disini offline masih rame bung pasar rame toko grosir sama toserba juga rame ada nya tik tok shop ngga ngaruh,11,positive
2023-10-03T23:44:48Z,@lilizatang3900,tapi kekadang beli online tak sesuai dgn barang yg di beli,7,positive
2023-10-03T23:45:15Z,@muchammadiqbal4989,bang betul sekali toserba yogya swalayan aja rame kok,4,positive
2023-10-03T23:52:14Z,@trivenarinirini1299,iya klu saya lbh memilih beli langsung,2,positive
2023-10-03T23:58:15Z,@defloranormayunitanubatoni4198,iya saya pun setuju kak,-2,negative
2023-10-09T22:44:29Z,@IKHWAN.F.H,kalau belum bisa ngatur hal baru kembalikan sistim dagang seperti dulu jangan ada perdagangan onlin sudah jelas onlin secara pakta riil mengganggu dan membunuh pasar bagai mana jika pasar seluruh indonesia bangkrut habis lah pajak dari parkir dan pasar tambah ancur ekonomi rakyat kecil,4,positive
2023-10-08T00:32:32Z,@Deddy.S.,sejauh mata memandang sih cukup adil,-3,negative
2023-10-07T00:21:41Z,@user-hz4sj6vr3l,ada yg diuntungkan amp ada juga yg dirugikan,8,positive
2023-10-06T07:41:46Z,@hambailmu6720,yang diuntungkan pasti menolak ditutup br yang dirugikan pasti setuju ditutup br br br semoga umkm maju,-4,negative
2023-10-05T06:23:21Z,@globekopi9169,memaksakan masyarakat untuk membeli mahal dasar otak pemerintah penindas rakyat,6,positive
2023-10-04T14:08:16Z,@ErniJohan-iz4iw,alhamdulillah tik tok tutup lagian yg ky makin kaya,4,positive
2023-10-04T11:25:00Z,@JimmyParlin,saya belanja online krn harga lebih murah dari pada harga di toko dekat rmh saya,1,positive
2023-10-04T06:35:42Z,@healthylife4973,masalah yg sesungguhnya adalah rakyat tdk mencintai produk dalam negri br ini yg harus di perbaiki rakyat sdh menghianati produk negaranya sendiri,4,positive
2023-10-04T13:15:39Z,@suhendra8670,yang murah ya itu yg dibeli,0,neutral
2023-10-04T05:28:39Z,@khadaxa,apapun peraturan bila ini tujuanya baik ya setuju namun yakin ini peraturan bisa merubah sitwasi ofline ingat ini zaman digital mestinya kalau mau turun berbisnis harus siap bersaing jangan cengeng tangisan ofline hanya bikin aparat terkait tambah gemuk,-4,negative
2023-10-03T11:35:18Z,@indrapokmen2918,kenapa ko judi online sampe sekarang ga di tutup quot kenapa,-2,negative
2023-10-03T09:18:02Z,@jekywang9155,di china pemulung pengemis pakai scab quris kalau minta quot in umkm kalah disektor digital karna efek gaptek gx mau belajar kita yg julan online ud tahun sekedar cari makan bukan kayak di rugikan,0,neutral
2023-10-03T01:31:38Z,@Juari-dp1dz,ambil yang lebih bermanfaat rakyat peningkat ekonomi merata tinggalkan yang ber efek keburukan yang menjadikan efek modorat dominasi ekonomi pemerataan global,-12,negative
2023-10-02T11:34:38Z,@bintangfajar-md4js,utk pemerintah pedagang offline hrsnya dah paham knp sepi mungkin dri segi harga jual terlalu tinggi sebelum pandemi siklus perdagangan udah sepi trus ke covid tambah sepi online shop sudah ada sejak dlu knp gak demo sejak dlu knp pas ada tiktok lagi rame jdi kambing hitam gak adil klu memang bisa mengikuti digitalisasi pemerintah perekonomian hadir utk mengedukasi digitalisasi bukn main tutup platform tau gak tiktok itu bisa merangkul umkm kecil mahasiswa pelajar bisa belajar wira usaha tanpa modal hrsny ini disupport pemerintah bukn mengikuti yng blm tentu benar klu memang minta ditutup semua platform ditutup juga internet tutup hp juga dilarang peredarannya tpi pemerintah hrs siap tanggung jawab dampak ini semua,-8,negative
2023-10-02T09:30:03Z,@ujungpanas9198,harusnya ada platform khusus grosir dan eceran di pisah atau ijin nya berbeda dan pajak nya berbeda,-10,negative
2023-10-02T03:10:27Z,@palistinamerdeka,sulit maju kalau tidak bisa mengikuti perkembangan zaman dan perkembangan teknologi manusia sekarang pengen yang instan sudah sudah malas ribet apalagi tawar menawar sering timbul mengibuli,-4,negative
2023-10-02T00:51:51Z,@breakhart,kalo indonesia lebih kearah supaya urus ijin dan perpajakan dulu aja karena yg dikenakan skrg masih pajak iklan belum pajak masing toko nya makanya hanya boleh promosi br br masalah data gw cm ketawa karena bocor nya malah data sering terutama data pemilik kartu kredit tapi ga pernah rame soal monopoli juga tiktok ga punya pengiriman sendiri dan pembayaran juga pakai payment yg ada bukan buat sendiri justru marketplace yg jelas punya pengiriman sendiri dan pembayaran sendiri santai aka kan,-24,negative
2023-10-01T14:11:47Z,@Juari-dp1dz,utamakan perekonomian rakyat serta membuka lapangan kerja rakyat maju lancar ekonomi lestri masa depan serta menjaga keseimbangan maju berkeadilan ekonomi maju bersama lancar,21,positive
2023-10-01T13:58:11Z,@Juari-dp1dz,pemerataan dan kesempatan hidup ekonomi rakyat bersama lestari lancar ekonomi masa depan jangka panjang ekonomi nasional rakyat semesta berke adilan ekomi stabil dalam kemajuan rakyat semesta,24,positive
2023-10-01T08:24:55Z,@iyussafrudin617,harusnya pajak masuk ke digital jadi harha tetap akan sama dengan yamg di pasar tradisional,-4,negative
2023-10-01T03:49:11Z,@baguspranata9189,cintai barang impor br br br biar indonesia banyak masyarakat kelaparan br kemiskinan meledak,4,positive
2023-09-30T13:02:41Z,@davepasaribu4468,wa ig fb senuanya aja dilarang bos biar balik lg kaya jaman purbakala negara lain udh mau ke bulan indonesia msh dibawah tanah miris,-5,negative
2023-09-30T13:01:45Z,@abangedo5566,banyak yg ga faham bkn platform amp produsennya tapi barang tu langsung impor semuaa mangkanya murah,9,positive
2023-09-30T11:38:48Z,@hafidzpoetrasampoerna8295,beli bahan murah dilarang yg bersaing kalah dengan yg ber uang,-5,negative
2023-09-30T10:45:15Z,@sengklekchenel1954,konsumen pasti milihnya yang murah lah,1,positive
2023-09-30T08:43:41Z,@SandiIswoyo-de7rp,saya sangat setuju kalo tiktok shop di tutup,2,positive
2023-09-30T05:12:07Z,@reisyawicaksono-mq2nq,tik tok shop di urusi wkkwkqkqkw korupsi moh habiskan dulj,-4,negative
2023-09-30T04:12:42Z,@roniramadhanni1538,kalo menurut ku sih ini sifatnya sementara era dan zamannya sdh berubah semua serba digital apalagi pangsa pasar e commerce yg luas br mudah dan prakti serta murah dari segi kita berbelanja menjadi sebuah kebutuhan beli lewat online,7,positive
2023-09-30T03:57:55Z,@gdgd1036,kalau pemerintah mau meningkat daya bei pasar bukan tiktok yg di tutup br ekonomi yg merosot tiktok yg jd kambing itam br baikin aja harga hasil tani di jamin rakyat makmur br terutama karet ma getah br politik pencitra an br ketololan yg ga di sadari,0,neutral
2023-09-30T03:00:41Z,@soborowo687,kemarin yg eluh kan digitalisasi,0,neutral
2023-09-29T23:40:24Z,@hanifprabowo1381,alasannya cuma satu yaitu duit biar tiktok bikin izin terus bayar ke pemerintah pasti ada aja cara buat malak tiktoknya kan udah kemaren dimintain bikin izin bayar sekian nah sekarang cari alasan lain bikin skenario seakan pro umkm offline padahal tujuan utama nya misahin tiktok shopnya supaya bikin izin juga tiktok jadi bayarnya dobel cuan ngga tuh,-18,negative
2023-09-29T15:59:41Z,@joesteve777,saran saya balik aja jaman batu blanja user ketemu pedagang uda usah pake acara online an tutupen ae biar fair kembali,-3,negative
2023-09-29T14:37:40Z,@qiao1976,jangan nanggung kalo tutup yg berbau online tutupin semua tidak ada lagi yg namanya internet banking dsb kita kembali ke zaman yang serbq manual saja,-20,negative
2023-09-29T14:13:43Z,@putriraja6631,yang seharudnya boleh berjualan itu artis bikan rakya tuh artis juslan dmua uang mo buat apaan coba knp pd ngalah sm masyarakat kecil,-3,negative
2023-09-29T12:24:17Z,@joeabdy3547,alhamdulillah semoga kedepanya lebih baik dan tetap jaya indonesia amiin,16,positive
2023-09-29T11:54:56Z,@ikhrom776,pasar ilang kumandange,-5,negative
2023-09-29T10:31:31Z,@robbyrosdiansyah5344,era digital br br kenapa umkm tidak jual online juga br br ngeleg otak gw,-1,negative
2023-09-29T09:54:46Z,@ainibintang-pg3lm,kenapa hanya tiktok yg di tutup apa karena shopee lazada dan dll karena kalah saing jangan ada batu di dalam udang,-12,negative
2023-09-29T09:50:21Z,@ainibintang-pg3lm,sudah basah mau gmn lagi dulu gak sediah payung sih,5,positive
2023-09-29T09:44:32Z,@wahidisnen6012,asli nya sih bagus kayak tok shopie dll untuk buat lapak digital tapi sayangnya di yang ada di situ itu kebanyakan barang barang yang ada di situ itu barang barang import dengan harga yang sangat jauh dari pasar nya,-5,negative
2023-09-29T07:40:30Z,@TheFikriez,capitalist berkedok socialist,0,neutral
2023-09-29T05:13:28Z,@fakta3459,kenapa hanya di tiktok yang di larang lazada dan lainnya amaaaan,-11,negative
2023-09-29T03:49:45Z,@ilovecuan,bukan soal gak bisa bersaing br ada beberapa yg sudah mulai berubah dari rantai perdagangan br br misal gudang pabrikan sendiri yg langsung jual barang nya ke online itu aja udah langsung bnyk putusin rantai perdagangan,-2,negative
2023-09-29T02:34:29Z,@angleswheels,tv hp sdh digital masa dagang disuruh konvensional yang kembali lagi biaya premanisne berkedok biaya keamanan sehingga harga barang jadi mahal br perlindungan konsumen itu honda gmn tuh buktinya bilang aja premanisme dihidupkan,-6,negative
2023-09-28T23:37:34Z,@solusi_ruang,ya sebagus nya online lebih bagus off line bertemu langsung ada silahturahmi ada akad jual beli,23,positive
2023-09-28T23:03:54Z,@rully809,online shop memberikan lapangsn pekerjaan juga kok ke jasa kurir dan mengurangi polusi dah kemacetan jg karena kt ga harus ke toko,-8,negative
2023-09-28T20:09:04Z,@nezukoshop,harusnya pemerintah memberikan kursus kursus kepada umkm umkm yang terkendala dengan digitalisasi ini bukannya malah melarang digitalisasi digitalisasi itu penting untuk kedepannya mengurangi orang keluar rumah berarti mengurangi emisi karbon jg kedua harus ada kerjasama dng platform tsb mana yg boleh dijual mana yg tidak boleh kalau semua barang disama ratakan itu ngga adil jg misal baju dilarang dijual di ecommerce pangan dll kalau kaya handphone masa ya dilarang aneh,-7,negative
2023-09-28T20:02:51Z,@nezukoshop,namanya kemajuan teknologi ya begini orang yg ga bs mengikuti perkembangan teknologi akan tertinggal dan kukut jangan nyalahin platform nya jaman gini mana mau orang jalan satu toko ke toko lain bandingin harga capek panas belum lagi belum tentu aman,5,positive
2023-10-25T00:34:12Z,@muchammadiqbal4989,itu kalau kamu kaum rebahan maunya yang instan gak mau capek karena kamu generasi zaman now kalau saya ogah banget di suruh rebahan karne saya orangnya suka sekali yang namanya jalan ke mall walaupun sekedar cuci mata setidaknya itu sebagai sarana hiburan saya ketika saya penat di rumah syukur syukur kalau ada rejeki beli tapi beli nya ya sewajarnya aja seperlunya aja dan itupun saya lakukan setiap tahun setiap bulan ramadhan jelang lebaran kalau setiap hari jarang beli,3,positive
2023-09-28T16:25:51Z,@addieL1610,tutup juga pinjol legal dan ilegal,-2,negative
2023-09-28T15:48:15Z,@victorlosari2652,setelah tiktok shop dilarang mereka merubah nama menjadi tokek shop,-3,negative
2023-09-28T15:22:34Z,@khairulwahab1390,ssh untuk korupsi,-4,negative
